<?xml version="1.0" encoding="utf-8"?>
<xs:schema xmlns:xs="http://www.w3.org/2001/XMLSchema" version="0.1" xml:lang="es">
<!-- AÃ±adimos el elemento restaurante-->
<xs:element name="Restaurante">
    <xs:complexType>
        <!-- Es un complextype porque hay varios elementos en el elemento restaurante-->
        <xs:sequence>
            <!-- Utilizamos el sequence para que todas las cosas esten ordenadas-->
            <xs:element name="reservas" maxOccurs="unbounded">
                <!-- Hemos utilizado unbouded para que en el xml no haya limite de reservas-->
                <xs:complexType>
                     <xs:sequence>
                                <xs:element name="nombre" minOccurs="1" maxOccurs="1">
                                     <xs:simpleType>
                                        <!-- Tenemos simpletype ya que al contrario que complextype solo tiene un elemento-->
                                           <xs:restriction base="xs:string">
                                            <!-- El comando xs:string es para decir que nuestro elemento es en texto-->
                                               <xs:whiteSpace value="preserve"/>
                                               <!-- El comando preserve te permite poner un espacio en caso de tener un nombre compuesto-->
                                           </xs:restriction>
                                     </xs:simpleType>
                                </xs:element>
                                <xs:element name="apellido" type="xs:string" minOccurs="1" maxOccurs="1"/>
                                <xs:element name="correoElectronico" minOccurs="1">
                                      <xs:simpleType>
                                            <xs:restriction base="xs:string">
                                                <xs:pattern value="[a-zA-Z0-9._%+-]+@[a-zA-Z0-9.-]+\.[a-zA-Z]{2,}"/>
                                                <!-- Los valores los cuales salen arriba, son aquellos valores que se permiten-->
                                            </xs:restriction>
                                      </xs:simpleType>
                                </xs:element>
                                <xs:element name="numeroTelefono" minOccurs="1" maxOccurs="1">
                                      <xs:simpleType>
                                            <xs:restriction base="xs:integer">
                                                <!-- xs:integer es para que el elemento se de tipo numerico (entero)-->
                                                <xs:totalDigits value="9"/>
                                                <!-- xs:totalDigits es para marcar cuantos valores tiene que haber como maximo-->
                                            </xs:restriction>
                                       </xs:simpleType>
                                </xs:element>
                                <xs:element name="numeroPersona" minOccurs="1" maxOccurs="1">
                                      <xs:simpleType>
                                            <xs:restriction base="xs:integer">
                                                <xs:maxExclusive value="31"/>
                                            </xs:restriction>
                                      </xs:simpleType>
                                 </xs:element> 
                                 <xs:element name="fecha" minOccurs="1" maxOccurs="1" type="xs:date"/>
                                 <!-- xs:date es para mostrarnos que es una fecha-->
                                 <xs:element name="horaReserva" maxOccurs="1" type="xs:time"/>
                                 <!-- xs:time es para mostrar que es una hora-->
                                               
                        </xs:sequence>
                        <xs:attribute name="idReserva" type="idReservaType" use="required"/>
                        <!-- required es para que ese campo sea obligatorio-->
                    </xs:complexType>
                   
                </xs:element>
                
            </xs:sequence>
       </xs:complexType>


</xs:element>

<xs:simpleType name="idReservaType">
                 <xs:restriction base="xs:integer">
                          <xs:totalDigits value="20"/>
                 </xs:restriction>
</xs:simpleType>
                   
            
</xs:schema>